"source.id","source.name","author","title","description","url","urlToImage","publishedAt","content"
business-insider,Business Insider,"Kwan Wei Kevin Tan","I landed a job at an AI startup right out of college. Here's what you should do if you want to work in AI.","Lambert Liu, 22, says being a holistic engineer who understands system design can help secure a job at an AI startup.","https://www.businessinsider.com/how-to-get-job-ai-startup-google-internships-tips-tech-2025-9","https://i.insider.com/68bfa2c5f9db348adc0b165c?width=1200&format=jpeg","2025-09-15T00:00:01Z","Lambert Liu, 22, is a software engineer at Graphite, an AI code review platform. While in college, Liu interned at Google and Replit.Lambert Liu
<ul><li>Lambert Liu, 22, is a recent graduate and sof… [+5043 chars]"
il-sole-24-ore,Il Sole 24 Ore,"di Francesca Barbieri","Master 2026: dal fintech all’Ai, ecco la guida per trovare lavoro","Fintech, intelligenza artificiale generativa, sostenibilità. Ma anche geopolitica, cybersecurity, data science e più in generale Stem (Science, technology, engineering e mathematics). Di fronte ai laureati intenzionati a proseguire...","https://www.ilsole24ore.com/art/master-2026-fintech-all-ai-ecco-guida-trovare-lavoro-AHBICzaC","https://i2.res.24o.it/images2010/S24/Documenti/2025/09/13/Immagini/Ritagli/copertina-U28317506024SzV-1440x752@IlSole24Ore-Web.jpg?r=1170x507","2025-09-12T10:29:52Z","Ascolta la versione audio dell'articolo
Fintech, intelligenza artificiale generativa, sostenibilità. Ma anche geopolitica, cybersecurity, data science e più in generale Stem (Science, technology, en… [+1494 chars]"
NA,Kdnuggets.com,"Natassha Selvaraj","Here’s How I Built an MCP to Automate My Data Science Job","A step-by-step guide to building a Model Context Protocol (MCP) for your data science team (and why adapting AI is the key to staying ahead in this field).","https://www.kdnuggets.com/built-an-mcp-to-automate-my-data-science-job","https://www.kdnuggets.com/wp-content/uploads/MCP-for-Data-Science-V1.jpeg","2025-09-15T16:00:36Z","Image by Ideogram
Most of my days as a data scientist look like this:
<ul><li>Stakeholder: ""Can you tell us how much we made in advertising revenue in the last month and what percentage of that cam… [+8673 chars]"
NA,Kdnuggets.com,"Vinod Chugani","Why Cybersecurity is More Important Today for Data Science Than Ever","AI systems powering critical decisions have become prime targets for sophisticated cyberattacks exploiting machine learning vulnerabilities.","https://www.kdnuggets.com/why-cybersecurity-is-more-important-today-for-data-science-than-ever","https://www.kdnuggets.com/wp-content/uploads/kdn-chugani-cybersecurity-important-today-data-science-than-ever-feature.png","2025-09-15T14:00:34Z","Image by Author | ChatGPT
Data science has evolved from academic curiosity to business necessity. Machine learning models now approve loans, diagnose diseases, and guide autonomous vehicles. But wit… [+6343 chars]"
NA,Posit.co,"Posit Team","Posit Signs Strategic Collaboration Agreement with AWS","The strategic collaboration agreement (SCA) allows enterprises to seamlessly migrate to the cloud to build, run, and leverage critical data science outcomes.
The post Posit Signs Strategic Collaboration Agreement with AWS appeared first on Posit.","https://posit.co/blog/posit-signs-strategic-collaboration-agreement-with-aws/","https://posit.co/wp-content/themes/Posit/dist/images/site-share-image-25.png","2025-09-12T12:02:29Z","The strategic collaboration agreement (SCA) allows enterprises to seamlessly migrate to the cloud to build, run, and leverage critical data science outcomes.
BOSTON, September 12, 2025 Posit PBC, a … [+4161 chars]"
NA,Science Daily,NA,"No one knows what these strange larvae grow into","Not all barnacles just sit on rocks and ships. Some invade crabs, growing like a parasitic root system that hijacks their bodies. A mysterious group called y-larvae has baffled scientists for over a century, with no known adult stage. Genetic evidence now rev…","https://www.sciencedaily.com/releases/2025/09/250913112506.htm","https://www.sciencedaily.com/images/1920/facetotectans.webp","2025-09-13T15:37:08Z","When you think of barnacles, you likely picture shell-like creatures stuck to the sides of boats or docks, or even whales. However, did you know that some of the barnacles that attach to other animal… [+6500 chars]"
NA,Enriquedans.com,"Enrique Dans","Inteligencia artificial y corrupción: por qué tiene sentido que una inteligencia artificial controle el gasto público","Albania ha dado un paso que muchos considerían impensable: nombrar a una «ministra» virtual para encargarse de la contratación pública. Se llama Diella y, según el primer ministro Edi Rama, será inmune a presiones, favores o amenazas, y adjudicará todos los c…","https://www.enriquedans.com/2025/09/inteligencia-artificial-y-corrupcion-por-que-tiene-sentido-que-una-inteligencia-artificial-controle-el-gasto-publico.html","https://www.enriquedans.com/wp-content/uploads/2025/09/Albania-AI-Dall·E.jpg","2025-09-14T07:22:55Z","Albania ha dado un paso que muchos considerían impensable: nombrar a una «ministra» virtual para encargarse de la contratación pública. Se llama Diella y, según el primer ministro Edi Rama, será inmu… [+7246 chars]"
NA,AdExchanger,"Sarah Sluis","AI-Driven Ad Tech Acquisitions","From a $637 million PE acquisition of healthcare of a DSP to acquisitions of freshly minted startups, there’s been a flurry of ad tech deals this month. And they have one thing in common: AI.
The post AI-Driven Ad Tech Acquisitions appeared first on AdExchang…","http://www.adexchanger.com/the-big-story/ai-driven-ad-tech-acquisitions/","https://www.adexchanger.com/wp-content/uploads/2023/10/Big-Story-podcast-square.jpg","2025-09-15T12:01:10Z","Five ad tech acquisitions in the span of a week would normally signal some kind of trend. But thats not quite the case with the deals that crossed our journalists desks this September.
There are dea… [+1627 chars]"
NA,BusinessLine,"Rohan Das","GUVI-HCL to take vernacular skilling global, eyes topline of ₹100 crore in FY26","The company offers students and young professionals a wide range of IT courses spanning programming, data science, app development, cybersecurity, and blockchain.","https://www.thehindubusinessline.com/specials/emerging-entrepreneurs/guvi-hcl-to-take-vernacular-skilling-global-eyes-topline-of-100-crore-in-fy26/article70036758.ece","https://bl-i.thgim.com/public/news/key6e0/article70048992.ece/alternates/LANDSCAPE_1200/BL1509_Spark_Anchor.jpg","2025-09-15T00:30:00Z","As a software engineer at PayPal, Arun Prakash saw firsthand a major issue plaguing the IT ecosystem in India a widening skill gap between the industry and academia. To address this, he started a You… [+3525 chars]"
NA,Hwupgrade.it,NA,"Mitsubishi Electric verso l'acquisizione di Nozomi Networks","Mitsubishi Electric ha partecipato al round di finanziamento di Serie E da 100 milioni di dollari di Nozomi annunciato a marzo 2024. Da allora. le due aziende hanno collaborato sullinnovazione e sul go-to-market, ponendo le basi di questa transazione","https://edge9.hwupgrade.it/news/market/mitsubishi-electric-verso-l-acquisizione-di-nozomi-networks_143471.html","https://www.hwupgrade.it/i/n/mitsubishi nozomi_720.jpg","2025-09-15T15:27:06Z","Mitsubishi Electric ha annunciato l'intenzione di voler acquisire Nozomi Networks, azienda svizzera specializzata in soluzioni per la protezione dell'IoT industriale. Un'operazione che era già nell'a… [+3697 chars]"
